{
  "id": "guangxi-gree-title-sponsor",
  "ownerIds": [
    "people-s-government-of-guangxi",
    "gree-group-zhuhai-sasac"
  ],
  "text": "The Tour of Guangxi is 'officially known as the GREE-Tour of Guangxi for sponsorship purposes' and runs 13–17 October 2026 as a UCI WorldTour race.",
  "short": "GREE titles the Tour of Guangxi",
  "source": {
    "name": "Cyclingnews - Gree-Tour of Guangxi 2026 stages (title-sponsor race name), corroborated by the race's own race record",
    "date": "2026-09-25",
    "url": "https://www.cyclingnews.com/gree-tour-of-guangxi/stages/"
  },
  "reviewed": false
}
