{
  "id": "rate-2026",
  "ownerIds": [
    "rate-formerly-guaranteed-rate-owner"
  ],
  "text": "Rate (formerly Guaranteed Rate) is the arena naming-rights holder of chicago-white-sox for 2026.",
  "short": "Arena naming-rights holder Rate (formerly Guaranteed Rate) 2026-27",
  "source": {
    "name": "MLB.com press release",
    "date": "2024-12-18",
    "url": "https://www.mlb.com/press-release/press-release-rate-and-chicago-white-sox-announce-rebrand-of-ballpark-introducing-rate-field"
  },
  "reviewed": false
}