{
  "id": "qsi-premier-padel-founder",
  "ownerIds": [
    "qatar-sports-investments"
  ],
  "text": "Premier Padel was founded by Qatar Sports Investments (QSI) together with the International Padel Federation (FIP) and the Professional Padel Association, and launched in 2022; in August 2023 QSI acquired World Padel Tour to create a single global tour governed by FIP. QSI is wholly owned by the Qatar Investment Authority.",
  "short": "QSI founded and owns Premier Padel",
  "source": {
    "name": "Premier Padel - Premier Padel announces multi-year partnership with Qatar Airways",
    "date": "2024-06-13",
    "url": "https://premierpadel.com/en/news/premier-padel-announces-multi-year-partnership-with-qatar-airways-2"
  },
  "reviewed": true
}