{
  "id": "ascension-st-vincent-2026",
  "ownerIds": [
    "ascension-st-vincent-owner"
  ],
  "text": "Ascension St. Vincent's is the jersey patch partner of indianapolis-colts for 2026-27.",
  "short": "Jersey patch partner Ascension St. Vincent's 2026-27",
  "source": {
    "name": "Zoomph (NFL practice-jersey sponsor tracker)",
    "date": "2026-09-01",
    "url": "https://zoomph.com/blog/the-ultimate-guide-to-nfl-practice-jersey-patch-sponsors/"
  },
  "reviewed": true
}