{
  "id": "adt-2026",
  "ownerIds": [
    "adt-owner"
  ],
  "text": "ADT is the jersey patch partner of miami-marlins for 2026.",
  "short": "Jersey patch partner ADT 2026-27",
  "source": {
    "name": "Sports Business Journal",
    "date": "2025-05-13",
    "url": "https://sportsbusinessjournal.com/Articles/2025/05/13/marlins-jersey-patch-sponsor-adt-renew-deal"
  },
  "reviewed": false
}