{
  "id": "amica-mutual-insurance-2026",
  "ownerIds": [
    "amica-mutual-insurance-owner"
  ],
  "text": "Amica Mutual Insurance is the jersey patch partner of boston-celtics for 2026.",
  "short": "Jersey patch partner Amica Mutual Insurance 2026-27",
  "source": {
    "name": "NBC Sports Boston",
    "date": "2024-07-09",
    "url": "https://www.nbcsportsboston.com/nba/boston-celtics/wyc-grousbeck-celtics-jersey-patch-sponsor-amica/627910"
  },
  "reviewed": false
}