{
  "id": "fedex-2026",
  "ownerIds": [
    "fedex-owner"
  ],
  "text": "FedEx is the arena naming-rights holder of memphis-grizzlies for 2026.",
  "short": "Arena naming-rights holder FedEx 2026",
  "source": {
    "name": "Inside Hoops (Grizzlies/FedEx release)",
    "date": "2025-01-01",
    "url": "https://insidehoops.com/blog/2025/01/grizzlies-and-fedex-to-continue-their-long-term-partnership"
  },
  "reviewed": false
}