{
  "id": "okta-inc-record",
  "ownerIds": [
    "okta-inc"
  ],
  "text": "Okta was founded in 2009 and had its initial public offering in 2017, reaching a valuation of over $6 billion.",
  "short": "Okta went public in its 2017 IPO.",
  "source": {
    "name": "Wikipedia – Okta, Inc.",
    "date": "2026-09-27",
    "url": "https://en.wikipedia.org/wiki/Okta,_Inc.",
    "quote": "It was founded in 2009 and had its initial public offering in 2017, reaching a valuation of over $6 billion.",
    "checked": {
      "on": "2026-09-27",
      "by": "Schnitzel"
    }
  },
  "reviewed": false
}
