{
  "id": "sinochem-holdings-record",
  "ownerIds": [
    "sinochem-holdings"
  ],
  "text": "Pirelli & C. SpA is Borsa Italiana-listed but has long been part-owned by Sinochem, a Chinese central state-owned enterprise under SASAC. Sinochem's vehicle Marco Polo International Italy sold a 14% block (151.9m shares at EUR 6.50) to Czech investor Lumina Crown in July 2026, cutting the Chinese state stake from about 34% to roughly 20%.",
  "short": "Pirelli & C.",
  "source": {
    "name": "European Rubber Journal, 'Sinochem completes EUR 1bn sale of Pirelli stake to Czech investor'",
    "date": "2026-08-03",
    "url": "https://www.european-rubber-journal.com/article/2099513/sinochem-completes-1bn-sale-of-pirelli-stake-to-czech-investor",
    "quote": "China National Chemical Corp. (Sinochem) has completed the sale of a 14% stake in Pirelli & C. SpA to Czech investment firm Lumina Crown, according to a regulatory filing",
    "checked": {
      "on": "2026-09-26",
      "by": "source-audit-2026-09-26"
    }
  },
  "reviewed": false
}
