{
  "id": "scotiabank-2026",
  "ownerIds": [
    "scotiabank-owner"
  ],
  "text": "Scotiabank is the arena naming-rights holder of toronto-raptors for 2026-27.",
  "short": "Arena naming-rights holder Scotiabank 2026-27",
  "source": {
    "name": "PR Newswire (Scotiabank / MLSE)",
    "date": "2017-08-29",
    "url": "https://www.prnewswire.com/news-releases/home-of-the-maple-leafs-and-raptors-to-become-scotiabank-arena-next-summer-642158183.html"
  },
  "reviewed": true
}