{
  "id": "american-family-insurance-2026",
  "ownerIds": [
    "american-family-mutual-insurance-company"
  ],
  "text": "American Family Insurance is the arena naming-rights holder of milwaukee-brewers for 2026.",
  "short": "Arena naming-rights holder American Family Insurance 2026-27",
  "source": {
    "name": "Wisconsin Public Radio (AP)",
    "date": "2020-01-22",
    "url": "https://www.wpr.org/economy/brewers-home-ballpark-be-renamed-american-family-field"
  },
  "reviewed": false
}