{
  "id": "msc-group-aponte-family-record",
  "ownerIds": [
    "msc-group-aponte-family"
  ],
  "text": "MSC Cruises, partner of Alpine and Napoli front sponsor, is the cruise division of MSC Group, which its own site describes as an independent, family-owned company founded in 1970 by Captain Gianluigi Aponte and now led by his son Diego Aponte, with ownership having passed to the founder's children. Entirely private Swiss-Italian family capital, no state stake. Human-rights relevance: shipping cruise labour and marine-fuel emissions, plus MSC's container-shipping scale.",
  "short": "MSC Cruises, partner of Alpine and Napoli front sponsor, is the cruise division of MSC Group, which its own site describes as an independent, family-owned company….",
  "source": {
    "name": "MSC - About us ('independent and family-owned company', Aponte family)",
    "date": "2026",
    "url": "https://www.msc.com/en/about-us",
    "quote": "MSC shipping is an independent and family-owned company. Established in 1970 by Founder and Group Chairman, Captain Gianluigi Aponte, MSC is now lead by his son, Group President, Diego Aponte.",
    "checked": {
      "on": "2026-09-26",
      "by": "source-audit-2026-09-26"
    }
  },
  "reviewed": false
}
